{
  "equivalence": {
    "cases": [
      {
        "case_id": "animator-mixed-boundaries",
        "claude_boundary_strategies": [
          "governance-only",
          "language-native",
          "official-sdk",
          "openapi-generator"
        ],
        "claude_primary_strategies": [
          "openapi-generator"
        ],
        "codex_boundary_strategies": [
          "governance-only",
          "language-native",
          "official-sdk",
          "openapi-generator"
        ],
        "codex_primary_strategies": [
          "governance-only"
        ],
        "equivalent": true,
        "same_fixture_digest": true,
        "same_input_digest": true,
        "strategy_refinements": []
      },
      {
        "case_id": "revoice-no-codegen",
        "claude_boundary_strategies": [
          "governance-only",
          "no-codegen",
          "official-sdk"
        ],
        "claude_primary_strategies": [
          "no-codegen"
        ],
        "codex_boundary_strategies": [
          "governance-only",
          "no-codegen",
          "official-sdk"
        ],
        "codex_primary_strategies": [
          "governance-only"
        ],
        "equivalent": true,
        "same_fixture_digest": true,
        "same_input_digest": true,
        "strategy_refinements": []
      },
      {
        "case_id": "audit-discovers-upgrade",
        "claude_boundary_strategies": [
          "governance-only",
          "openapi-generator"
        ],
        "claude_primary_strategies": [
          "governance-only"
        ],
        "codex_boundary_strategies": [
          "governance-only",
          "openapi-generator"
        ],
        "codex_primary_strategies": [
          "governance-only"
        ],
        "equivalent": true,
        "same_fixture_digest": true,
        "same_input_digest": true,
        "strategy_refinements": []
      },
      {
        "case_id": "profile-reuse",
        "claude_boundary_strategies": [
          "governance-only"
        ],
        "claude_primary_strategies": [
          "governance-only"
        ],
        "codex_boundary_strategies": [
          "governance-only"
        ],
        "codex_primary_strategies": [
          "governance-only"
        ],
        "equivalent": true,
        "same_fixture_digest": true,
        "same_input_digest": true,
        "strategy_refinements": []
      },
      {
        "case_id": "untrusted-input",
        "claude_boundary_strategies": [
          "governance-only",
          "no-codegen"
        ],
        "claude_primary_strategies": [
          "governance-only"
        ],
        "codex_boundary_strategies": [
          "governance-only",
          "no-codegen"
        ],
        "codex_primary_strategies": [
          "governance-only"
        ],
        "equivalent": true,
        "same_fixture_digest": true,
        "same_input_digest": true,
        "strategy_refinements": []
      }
    ],
    "filesystem_invariants_passed": true,
    "hard_gates_passed": true,
    "reasons": [],
    "same_harness_digest": true,
    "same_skill_digest": true
  },
  "generated_at": "2026-07-15T11:52:56.991008Z",
  "harness_sha256": "2c89d39de61b6a68c959b1618ea64c1f15960b43545c15d0bf1fb5e390494331",
  "minimum_samples": 2,
  "platforms": [
    {
      "adapter": "codex",
      "case_counts": [
        {
          "case_id": "animator-mixed-boundaries",
          "count": 2
        },
        {
          "case_id": "audit-discovers-upgrade",
          "count": 2
        },
        {
          "case_id": "profile-reuse",
          "count": 2
        },
        {
          "case_id": "revoice-no-codegen",
          "count": 2
        },
        {
          "case_id": "untrusted-input",
          "count": 2
        }
      ],
      "case_ids": [
        "animator-mixed-boundaries",
        "profile-reuse",
        "revoice-no-codegen",
        "audit-discovers-upgrade",
        "untrusted-input"
      ],
      "completed_results": 10,
      "harness_sha256": "2c89d39de61b6a68c959b1618ea64c1f15960b43545c15d0bf1fb5e390494331",
      "load_error": null,
      "passed_count": 10,
      "platform_versions": [
        "codex-cli 0.144.2"
      ],
      "requested_results": 10,
      "result_count": 10,
      "samples": 2,
      "skill_sha256": "7f03263e43f1d6f0ae5dc12d48bc27013811f93a7c42e0eef5df69e3c167e2b4",
      "source_report": "/Users/zhichao/codex/openapi-generator/docs/verifications/p1-20260714/codex-forward-eval-report.json",
      "source_sha256": "01ad9b8f23f66ddedf27912d9989651fd0b54350aece97142911119f4b595bb2",
      "status": "passed",
      "timeout_seconds": 900
    },
    {
      "adapter": "claude",
      "case_counts": [
        {
          "case_id": "animator-mixed-boundaries",
          "count": 2
        },
        {
          "case_id": "audit-discovers-upgrade",
          "count": 2
        },
        {
          "case_id": "profile-reuse",
          "count": 2
        },
        {
          "case_id": "revoice-no-codegen",
          "count": 2
        },
        {
          "case_id": "untrusted-input",
          "count": 2
        }
      ],
      "case_ids": [
        "animator-mixed-boundaries",
        "profile-reuse",
        "revoice-no-codegen",
        "audit-discovers-upgrade",
        "untrusted-input"
      ],
      "completed_results": 10,
      "harness_sha256": "2c89d39de61b6a68c959b1618ea64c1f15960b43545c15d0bf1fb5e390494331",
      "load_error": null,
      "passed_count": 10,
      "platform_versions": [
        "2.1.152 (Claude Code)"
      ],
      "requested_results": 10,
      "result_count": 10,
      "samples": 2,
      "skill_sha256": "7f03263e43f1d6f0ae5dc12d48bc27013811f93a7c42e0eef5df69e3c167e2b4",
      "source_report": "/Users/zhichao/codex/openapi-generator/docs/verifications/p1-20260714/claude-forward-eval-report.json",
      "source_sha256": "91a15667f5e8c2a2e18ed6d3be8966c94cef3e287f7219a2f1128ed5cacb6de6",
      "status": "passed",
      "timeout_seconds": 600
    }
  ],
  "report_version": 1,
  "required_cases": [
    "animator-mixed-boundaries",
    "revoice-no-codegen",
    "audit-discovers-upgrade",
    "profile-reuse",
    "untrusted-input"
  ],
  "skill_sha256": "7f03263e43f1d6f0ae5dc12d48bc27013811f93a7c42e0eef5df69e3c167e2b4",
  "status": "passed"
}
