{
  "equivalence": {
    "cases": [
      {
        "case_id": "animator-mixed-boundaries",
        "claude_boundary_strategies": [
          "governance-only",
          "language-native",
          "no-codegen",
          "official-sdk",
          "openapi-generator"
        ],
        "claude_primary_strategies": [
          "openapi-generator"
        ],
        "codex_boundary_strategies": [
          "governance-only",
          "language-native",
          "official-sdk",
          "openapi-generator"
        ],
        "codex_primary_strategies": [
          "openapi-generator"
        ],
        "equivalent": false,
        "same_fixture_digest": true,
        "same_input_digest": true,
        "strategy_refinements": []
      },
      {
        "case_id": "revoice-no-codegen",
        "claude_boundary_strategies": [
          "governance-only",
          "no-codegen",
          "official-sdk"
        ],
        "claude_primary_strategies": [
          "no-codegen"
        ],
        "codex_boundary_strategies": [
          "governance-only",
          "no-codegen",
          "official-sdk",
          "openapi-generator"
        ],
        "codex_primary_strategies": [
          "governance-only",
          "no-codegen"
        ],
        "equivalent": false,
        "same_fixture_digest": true,
        "same_input_digest": true,
        "strategy_refinements": []
      },
      {
        "case_id": "audit-discovers-upgrade",
        "claude_boundary_strategies": [
          "governance-only",
          "openapi-generator"
        ],
        "claude_primary_strategies": [
          "governance-only"
        ],
        "codex_boundary_strategies": [
          "governance-only",
          "openapi-generator"
        ],
        "codex_primary_strategies": [
          "governance-only"
        ],
        "equivalent": true,
        "same_fixture_digest": true,
        "same_input_digest": true,
        "strategy_refinements": []
      },
      {
        "case_id": "profile-reuse",
        "claude_boundary_strategies": [
          "governance-only",
          "openapi-generator"
        ],
        "claude_primary_strategies": [
          "governance-only"
        ],
        "codex_boundary_strategies": [
          "governance-only"
        ],
        "codex_primary_strategies": [
          "governance-only"
        ],
        "equivalent": false,
        "same_fixture_digest": true,
        "same_input_digest": true,
        "strategy_refinements": []
      },
      {
        "case_id": "untrusted-input",
        "claude_boundary_strategies": [
          "governance-only",
          "no-codegen"
        ],
        "claude_primary_strategies": [
          "governance-only"
        ],
        "codex_boundary_strategies": [
          "governance-only",
          "no-codegen"
        ],
        "codex_primary_strategies": [
          "governance-only"
        ],
        "equivalent": true,
        "same_fixture_digest": true,
        "same_input_digest": true,
        "strategy_refinements": []
      }
    ],
    "filesystem_invariants_passed": true,
    "hard_gates_passed": false,
    "reasons": [
      "primary strategy mismatch for animator-mixed-boundaries",
      "primary strategy mismatch for profile-reuse",
      "primary strategy mismatch for revoice-no-codegen"
    ],
    "same_harness_digest": true,
    "same_skill_digest": true
  },
  "generated_at": "2026-07-15T16:13:29.730212Z",
  "harness_sha256": "bba8e605c3f5e6be0dfdd63d2739898d59e1a503f1377136384302b63e169b97",
  "minimum_samples": 2,
  "platforms": [
    {
      "adapter": "codex",
      "case_counts": [
        {
          "case_id": "animator-mixed-boundaries",
          "count": 2
        },
        {
          "case_id": "audit-discovers-upgrade",
          "count": 2
        },
        {
          "case_id": "profile-reuse",
          "count": 2
        },
        {
          "case_id": "revoice-no-codegen",
          "count": 2
        },
        {
          "case_id": "untrusted-input",
          "count": 2
        }
      ],
      "case_ids": [
        "animator-mixed-boundaries",
        "profile-reuse",
        "revoice-no-codegen",
        "audit-discovers-upgrade",
        "untrusted-input"
      ],
      "completed_results": 10,
      "harness_sha256": "bba8e605c3f5e6be0dfdd63d2739898d59e1a503f1377136384302b63e169b97",
      "load_error": null,
      "passed_count": 10,
      "platform_versions": [
        "codex-cli 0.144.2"
      ],
      "requested_results": 10,
      "result_count": 10,
      "samples": 2,
      "skill_sha256": "fe590fed8be092f66d2615f6dd6a65a21585d32efb34833712fbb603968cf6c7",
      "source_report": "/Users/zhichao/codex/openapi-generator/docs/verifications/p2-20260715/codex-forward-eval-report.json",
      "source_sha256": "767f5f62a05de1fca1eec387bbc61b20f4c66a0688dea7b1e9c91905d3469b97",
      "status": "passed",
      "timeout_seconds": 900
    },
    {
      "adapter": "claude",
      "case_counts": [
        {
          "case_id": "animator-mixed-boundaries",
          "count": 2
        },
        {
          "case_id": "audit-discovers-upgrade",
          "count": 2
        },
        {
          "case_id": "profile-reuse",
          "count": 2
        },
        {
          "case_id": "revoice-no-codegen",
          "count": 2
        },
        {
          "case_id": "untrusted-input",
          "count": 2
        }
      ],
      "case_ids": [
        "animator-mixed-boundaries",
        "profile-reuse",
        "revoice-no-codegen",
        "audit-discovers-upgrade",
        "untrusted-input"
      ],
      "completed_results": 10,
      "harness_sha256": "bba8e605c3f5e6be0dfdd63d2739898d59e1a503f1377136384302b63e169b97",
      "load_error": null,
      "passed_count": 10,
      "platform_versions": [
        "2.1.152 (Claude Code)"
      ],
      "requested_results": 10,
      "result_count": 10,
      "samples": 2,
      "skill_sha256": "fe590fed8be092f66d2615f6dd6a65a21585d32efb34833712fbb603968cf6c7",
      "source_report": "/Users/zhichao/codex/openapi-generator/docs/verifications/p2-20260715/claude-forward-eval-report.json",
      "source_sha256": "b85ed208c222d751ccca41c462c1aa8e51156cf97a887c3b01da1c86bc4409cb",
      "status": "passed",
      "timeout_seconds": 600
    }
  ],
  "report_version": 1,
  "required_cases": [
    "animator-mixed-boundaries",
    "revoice-no-codegen",
    "audit-discovers-upgrade",
    "profile-reuse",
    "untrusted-input"
  ],
  "skill_sha256": "fe590fed8be092f66d2615f6dd6a65a21585d32efb34833712fbb603968cf6c7",
  "status": "failed"
}
